{
  "engine": "ACE",
  "version": "phase-c11",
  "governance": {
    "mode": "structure-only",
    "exposed": false,
    "note": "Dormant client engagement intake definition."
  },
  "form": {
    "sections": [
      {
        "id": "organisation",
        "label": "Organisation",
        "fields": [
          { "id": "org-name", "label": "Organisation name", "type": "text", "required": true },
          { "id": "contact-name", "label": "Primary contact name", "type": "text", "required": true },
          { "id": "contact-email", "label": "Contact email", "type": "email", "required": true }
        ]
      },
      {
        "id": "engagement",
        "label": "Engagement overview",
        "fields": [
          {
            "id": "engagement-type",
            "label": "Engagement type",
            "type": "select",
            "required": true,
            "options": ["Delivery partner", "Client", "Public sector", "Other"]
          },
          {
            "id": "initial-scope",
            "label": "Initial scope description",
            "type": "text",
            "required": false
          }
        ]
      },
      {
        "id": "governance",
        "label": "Governance & access",
        "fields": [
          {
            "id": "nda-required",
            "label": "NDA required before disclosure",
            "type": "boolean",
            "required": true
          }
        ]
      }
    ]
  }
}
